{
  "abstract": {
    "en": "Attitude of the political leadership (members of parliament) in the USA to other nations and problems in world politics.",
    "de": "Einstellung der politischen Führungsschicht (Parlamentsmitglieder) in den USA zu anderen Nationen und weltpolitischen Problemen."
  },
  "classifications": {
    "de": [
      {
        "vocab": "ZA-Kategorien",
        "term": "Politische Fragen (Issues)"
      },
      {
        "vocabUri": "https://vocabularies.cessda.eu/urn/urn:ddi:int.cessda.cv:TopicClassification:4.2.2",
        "vocab": "CESSDA Topic Classification",
        "term": "Internationale Politik und Internationale Organisationen"
      },
      {
        "vocabUri": "https://vocabularies.cessda.eu/urn/urn:ddi:int.cessda.cv:TopicClassification:4.2.2",
        "vocab": "CESSDA Topic Classification",
        "term": "Konflikte, Sicherheit und Frieden"
      }
    ],
    "en": [
      {
        "vocab": "ZA-Categories",
        "term": "Political Issues"
      },
      {
        "vocabUri": "https://vocabularies.cessda.eu/urn/urn:ddi:int.cessda.cv:TopicClassification:4.2.2",
        "vocab": "CESSDA Topic Classification",
        "term": "International politics and organisations"
      },
      {
        "vocabUri": "https://vocabularies.cessda.eu/urn/urn:ddi:int.cessda.cv:TopicClassification:4.2.2",
        "vocab": "CESSDA Topic Classification",
        "term": "Conflict, security and peace"
      }
    ]
  },
  "creators": {
    "en": [
      {
        "name": "Synthetic ORCID",
        "identifiers": [{
          "id": "0000-0000-0000-0000",
          "type": "ORCID",
          "uri": "https://orcid.org/0000-0000-0000-0000",
          "role": "pid"
        }]
      }
    ],
    "de": [
      {
        "name": "Synthetic ORCID de",
        "identifiers": [{
          "id": "0000-0000-0000-0000",
          "type": "ORCID",
          "uri": "https://orcid.org/0000-0000-0000-0000",
          "role": "pid"
        }]
      }
    ]
  },
  "dataAccess": "Open",
  "dataAccessFreeTexts": {
    "en": [
      "Data and documents are only released for academic research and teaching after the data depositor's written authorization."
    ],
    "de": [
      "Daten und Dokumente sind für die akademische Forschung und Lehre nur nach schriftlicher Genehmigung des Datengebers zugänglich."
    ]
  },
  "dataAccessUrl": {
  },
  "dataCollectionFreeTexts": {
  },
  "dataCollectionYear": 1958,
  "dataCollectionPeriodEnddate": "1958-04",
  "dataCollectionPeriodStartdate": "1958-02",
  "dataKindFreeTexts": {
    "en": [
      {
        "dataKindFreeText": "Numeric",
        "type": "Quantitative"
      }
    ]
  },
  "fileLanguages":[],
  "funding": {
    "en": [
      {
        "agency": "GESIS - Leibniz Institute for the Social Sciences",
        "grantNumber": "Grant Number"
      }
    ],
    "de": [
      {
        "agency": "GESIS - Leibniz Institut für Sozialwissenschaften",
        "grantNumber": "Grant Number"
      }
    ]
  },
  "generalDataFormats": {},
  "keywords": {
    "en": [
      {
        "vocabUri": "https://elsst.cessda.eu/id/",
        "vocab": "ELSST",
        "term": "POLITICAL ISSUES"
      }
    ]
  },
  "lastModified": "2023-12-06T13:30:08.8725293Z",
  "pidStudies": {
    "*": [
      {
        "agency": "DOI",
        "pid": "doi:10.4232/1.0004"
      }
    ]
  },
  "publisher": {
    "en": {
      "abbr": "GESIS",
      "publisher": "GESIS - Leibniz Institute for the Social Sciences"
    },
    "de": {
      "publisher": "GESIS - Leibniz Institut für Sozialwissenschaften"
    }
  },
  "publicationYear": "1964",
  "relatedPublications": {
    "en": [{
      "title": "Synthetic Publication 1",
      "holdings": [
        "https://doi.org/10.4232/00000",
        "doi:10.4232/00000"
      ],
      "publicationDate": "2025"
     }
    ],
    "de": [{
      "title": "Synthetische Publikation 1",
      "holdings": [
        "https://doi.org/10.4232/00000",
        "doi:10.4232/00000"
      ],
      "publicationDate": "2025"
    }]
  },
  "repositoryUrl": "http://dbkapps.gesis.org/dbkoai/oai.asp",
  "series": {
    "de": [
      {
        "names": ["Ausgedachter Serienname"],
        "descriptions": ["Dies ist ein Beispiel für eine Serienbeschreibung. Diese erfundene Serie wurde über mehrere erfundene Jahrzehnte hinweg gesammelt."],
        "uris": ["https://example.com/series", "https://example.com/seriesaltlink", "https://example.com/series", "https://example.com/seriesaltlink"]
      }
    ],
    "en": [
      {
        "names": ["Made up series name", "Has second made up name in English"],
        "descriptions": ["This is an example of series description. This made up series has been collected over several made-up decades."],
        "uris": ["https://example.com/series", "https://example.com/seriesaltlink", "https://example.com/series", "https://example.com/seriesaltlink"]
      },
      {
        "names": ["Simple second series test"],
        "descriptions": [],
        "uris": []
      }
    ]
  },
  "studyAreaCountries": {
    "de": [{
      "abbr": "US",
      "country": "Vereinigte Staaten von Amerika"
    }],
    "en": [{
      "abbr": "US",
      "country": "United States of America"
    }]
  },
  "studyNumber": "oai:dbk.gesis.org:DBK/ZA0004",
  "studyUrl": {
  },
  "studyXmlSourceUrl": "https://oai.ukdataservice.ac.uk:8443/oai/provider?verb=GetRecord&identifier=oai%3Adbk.gesis.org%3ADBK%2FZA0004&metadataPrefix=ddi",
  "titleStudy": {
    "en": "International Outlooks of Political Leaders (USA)",
    "de": "International Outlooks of Political Leaders (USA)"
  },
  "typeOfModeOfCollections": {
    "en": [
      {
        "term": "Oral survey with standardized questionnaire"
      }
    ],
    "de": [
      {
        "term": "Mündliche Befragung mit standardisiertem Fragebogen"
      }
    ]
  },
  "typeOfSamplingProcedures": {
    "en": [
      {
        "vocabUri": "urn:ddi:int.ddi.cv:SamplingProcedure:1.1.4",
        "term": "Quota sample"
      }
    ],
    "de": [
      {
        "vocabUri": "urn:ddi:int.ddi.cv:SamplingProcedure:1.1.4",
        "term": "Quotenauswahl"
      }
    ]
  },
  "typeOfTimeMethods": {
    "en": [
      {
        "vocabUri": "urn:ddi:int.ddi.cv:TimeMethod:1.2.3",
        "vocab": "TimeMethod",
        "term": "Longitudinal"
      }
    ]
  },
  "unitTypes": {
    "en": [{
      "vocabUri": "urn:ddi:int.ddi.cv:AnalysisUnit:2.1.3",
      "vocab": "AnalysisUnit",
      "term": "Individual"
    }]
  },
  "universe": {
    "de": {
      "inclusion": "Kongressmitglieder (Senat und Repräsentantenhaus)"
    },
    "en": {
      "inclusion": "Members of congress (Senate and House of Representatives)."
    }
  }
}
