{
  "pidStudies": {
    "*": [
      {
        "pid": "\nch.sidos.ddi.468.7773\n"
      }
    ]
  },
  "keywords": {
    "xy": [
      {
        "vocabUri": "",
        "vocab": "",
        "term": "Médias et confiance",
        "id": ""
      },
      {
        "vocabUri": "",
        "vocab": "",
        "term": "Politique",
        "id": ""
      },
      {
        "vocabUri": "",
        "vocab": "",
        "term": "Immigration",
        "id": ""
      },
      {
        "vocabUri": "",
        "vocab": "",
        "term": "Bien-être subjectif",
        "id": ""
      },
      {
        "vocabUri": "",
        "vocab": "",
        "term": "Religion",
        "id": ""
      },
      {
        "vocabUri": "",
        "vocab": "",
        "term": "Exclusion sociale",
        "id": ""
      },
      {
        "vocabUri": "",
        "vocab": "",
        "term": "Santé et soins",
        "id": ""
      },
      {
        "vocabUri": "",
        "vocab": "",
        "term": "Moralité économique",
        "id": ""
      },
      {
        "vocabUri": "",
        "vocab": "",
        "term": "Démographie",
        "id": ""
      },
      {
        "vocabUri": "",
        "vocab": "",
        "term": "Famille et bien-être",
        "id": ""
      },
      {
        "vocabUri": "",
        "vocab": "",
        "term": "Valeurs",
        "id": ""
      },
      {
        "vocabUri": "",
        "vocab": "",
        "term": "Identification",
        "id": ""
      },
      {
        "vocabUri": "",
        "vocab": "",
        "term": "Participation",
        "id": ""
      }
    ]
  },
  "dataCollectionPeriodStartdate": "2004-09-16",
  "dataCollectionYear": 2004,
  "dataAccessUrl": {},
  "typeOfTimeMethods": {
    "xy": [
      {
        "vocabUri": "",
        "vocab": "",
        "term": "Enquête transversale",
        "id": ""
      }
    ]
  },
  "creators": {
    "*": [
      {
        "name": "Joye, Dominique (resp.)",
        "affiliation": "Service suisse d'information et d'archivage de données pour les sciences sociales - SIDOS"
      },
      {
        "name": "Schöbi, Nicole",
        "affiliation": "Service suisse d'information et d'archivage de données pour les sciences sociales - SIDOS"
      },
      {
        "name": "Kaenel, Céline",
        "affiliation": "Service suisse d'information et d'archivage de données pour les sciences sociales - SIDOS"
      }
    ]
  },
  "abstract": {
    "xy": "L'enquête \"European Social Survey\" (ESS, http://www.europeansocialsurvey.org) est une nouvelle enquête destinée à mesurer les attitudes et croyances des populations européennes et à expliquer les réactions aux changements des institutions en Europe. Pourquoi une nouvelle enquête ? D'abord pour attaquer des problématiques qui sont au coeur des préoccupations des chercheurs aujourd'hui. Par exemple, qu'est-ce que la citoyenneté aujourd'hui ? Comment les différents pays européens vivent-ils les questions posées par l'immigration ?\nCette enquête est aussi nouvelle  car elle vise des standards de qualité très élevés, et impose donc de nombreuses et sévères conditions méthodologiques, de telle sorte que les données soient vraiment comparables entre les pays. Plus de 20 pays ont participé à la deuxième édition qui s'est déroulée en automne 2004. La prochaine édition aura lieu en 2006, puisqu'il est prévu de réaliser une enquête ESS toutes les deux années.\n\nLa deuxième enquête ESS en Suisse fut réalisée par l'institut MIS Trend, mandaté par l'archive suisse pour les sciences sociales, le SIDOS (actuellement FORS : http://forscenter.ch/fr/ ). Le terrain s'est terminé fin février 2005, avec plus de 2000 personnes interrogées en Suisse."
  },
  "series": {
    "xy": [
      {
        "names": ["European Social Survey"],
        "descriptions": [],
        "uris": []
      }
    ]
  },
  "studyAreaCountries": {
    "xy": [
      {
        "country": "Suisse",
        "abbr": "CH"
      }
    ]
  },
  "dataCollectionFreeTexts": {
    "*": [
      {
        "dataCollectionFreeText": "start",
        "event": "start"
      },
      {
        "dataCollectionFreeText": "end",
        "event": "end"
      },
      {
        "dataCollectionFreeText": "No date"
      }
    ]
  },
  "dataAccess": "Uncategorized",
  "dataAccessFreeTexts": {
    "xy": [
      "Aucune"
    ]
  },
  "classifications": {
    "xy": [
      {
        "vocabUri": "",
        "vocab": "",
        "term": "Médias, confiance, politique, immigration, bien-être subjectif, religion, exclusion sociale, santé et soins, moralité économique, démographie, famille, valeurs, identification, participation",
        "id": ""
      }
    ]
  },
  "titleStudy": {
    "xy": "European Social Survey in Switzerland - 2004"
  },
  "unitTypes": {
    "xy": [
      {
        "vocabUri": "",
        "vocab": "",
        "term": "Individu",
        "id": ""
      }
    ]
  },
  "dataCollectionPeriodEnddate": "2005-02-28",
  "publisher": {
    "xy": {
      "publisher": "Data and Research Information Services",
      "abbr": "DARIS"
    }
  },
  "publicationYear": "2007",
  "lastModified": "2015-05-04T22:55:30+0000",
  "studyUrl": {
    "*": "http://forscenter.ch/fr/service-de-donnees-et-d-information-sur-la-recherche/"
  },
  "studyNumber": "http://fors-getdata.unil.ch:80/obj/fStudy/ch.sidos.ddi.468.7773",
  "typeOfModeOfCollections": {
    "xy": [
      {
        "vocabUri": "",
        "vocab": "",
        "term": "Entretien téléphonique",
        "id": ""
      }
    ]
  },
  "fileLanguages": [],
  "funding": {},
  "typeOfSamplingProcedures": {
    "xy": [
      {
        "vocabUri": "",
        "vocab": "",
        "term": "Sélection aléatoire à 3 phases:\n1) Tirage aléatoire de Sample points: 222 Sample Points ont été tirés aléatoirement après qu'ils aient été stratifiés selon les six régions suivantes:\n- Région lémanique (VD, VS, GE)\n- Espace Mittelland (BE, FR, SO, NE, JU)\n- Nordschweiz (ZH, BS, BL, AG)\n- Ostschweiz (GL, SH, AR, AI, SG, GR, TG)\n- Zentralschweiz (LU, UR, SZ, OW, NW, ZG)\n- Ticino (TI)\n2) Sélection aléatoire des ménages à partir du registre téléphonique;\n3) Tirage de la personne-cible au moyen de la méthode KISH.",
        "id": ""
      }
    ]
  },
  "universe": {
    "xy": {
      "inclusion": "Population suisse âgée de 15 ans et plus parlant allemand, français ou italien."
    }
  },
  "dataKindFreeTexts": {
    "xy": [
      {
        "dataKindFreeText": "Données quantitatives"
      }
    ]
  },
  "generalDataFormats": {},
  "relatedPublications": {},
  "repositoryUrl": "http://fors-getdata.unil.ch/",
  "studyXmlSourceUrl": "https://oai-pmh.nsd.no/oai-pmh?verb=GetRecord&identifier=http%3A%2F%2Ffors-getdata.unil.ch%3A80%2Fobj%2FfStudy%2Fch.sidos.ddi.468.7773&metadataPrefix=oai_ddi"
}
